{
  "schema_version": "1.0",
  "policy_version": "1",
  "mode": "auto",
  "role": "executor",
  "requested": true,
  "eligible": true,
  "failure_type": "reasoning_failure",
  "same_failure": true,
  "material_failure": true,
  "no_meaningful_progress": true,
  "recovery_used": false,
  "selected_model_tier": "standard",
  "recovery_ceiling_model_tier": "strong",
  "requested_model_tier": "strong",
  "dispatch_model_tier": "strong",
  "effective_model_tier": "strong",
  "model_matches": true,
  "model_selector_available": true,
  "status": "verified",
  "reason": "verified",
  "conflict": null,
  "conflict_reason": null
}
