{
  "schema_version": "1.0",
  "policy_version": "1",
  "mode": "auto",
  "role": "executor",
  "requested": true,
  "eligible": true,
  "failure_type": "reasoning_failure",
  "same_failure": true,
  "material_failure": true,
  "no_meaningful_progress": true,
  "recovery_used": false,
  "selected_model_tier": "standard",
  "recovery_ceiling_model_tier": "strong",
  "requested_model_tier": "strong",
  "dispatch_model_tier": "strong",
  "effective_model_tier": null,
  "model_matches": null,
  "model_selector_available": true,
  "status": "requested",
  "reason": "awaiting_trace",
  "conflict": null,
  "conflict_reason": null,
  "recovery_stage": {
    "strategy": {
      "id": "lsa-qualified-execution-v2",
      "version": "2"
    },
    "status": "requested",
    "stage": "strong-medium",
    "previous_stage": "source-qualified",
    "requested_effort": "medium",
    "dispatch_effort": "medium",
    "uses_model_uplift": true,
    "source": {
      "model_set": {
        "id": "openai",
        "version": "5",
        "mapping_digest": "sha256:9b28023fbf9a2b79dc3d6caf72d094dbb81c9a0106816bdfbf4b7255dc7b9474"
      },
      "reasoning_projection": {
        "id": "openai-gpt6-v1",
        "version": "2",
        "policy_version": "3",
        "digest": "sha256:152b4d5b65d6f979948be91d21ec7c547c134aa364b205ad5cd2f8f51e9c63ad"
      },
      "role_binding": {
        "role": "executor",
        "model_tier": "standard",
        "model": "gpt-6.1-sol",
        "mapping_digest": "sha256:9b28023fbf9a2b79dc3d6caf72d094dbb81c9a0106816bdfbf4b7255dc7b9474"
      },
      "provenance": {
        "source": "workspace_profile",
        "override": null
      }
    },
    "target": {
      "model_set": {
        "id": "openai",
        "version": "5",
        "mapping_digest": "sha256:9b28023fbf9a2b79dc3d6caf72d094dbb81c9a0106816bdfbf4b7255dc7b9474"
      },
      "reasoning_projection": {
        "id": "openai-gpt6-v1",
        "version": "2",
        "policy_version": "3",
        "digest": "sha256:152b4d5b65d6f979948be91d21ec7c547c134aa364b205ad5cd2f8f51e9c63ad"
      },
      "role_binding": {
        "role": "executor",
        "model_tier": "strong",
        "model": "gpt-6-astra",
        "mapping_digest": "sha256:9b28023fbf9a2b79dc3d6caf72d094dbb81c9a0106816bdfbf4b7255dc7b9474"
      },
      "provenance": {
        "source": "workspace_profile",
        "override": {
          "kind": "capability_recovery",
          "version": "1",
          "source_model_tier": "standard",
          "target_model_tier": "strong"
        }
      }
    },
    "latest_verified_effort": "high",
    "retry_claim": {
      "expected_used": 1,
      "next_used": 2,
      "max": 3
    },
    "uplift_claim": {
      "expected_used": false,
      "next_used": true
    },
    "reason": "qualified_initial_uplift",
    "conflict": null,
    "conflict_reason": null
  }
}
